<?xml version="1.0"?>
<bookList xmlns:xsi="http://www.w3.org/2001/XMLSchema-instance"
xsi:schemaLocation="http://books book.xsd"
xmlns="http://books">
  <book inStock="Yes" price="64.14">
  	<title>Principles: How they got lost.</title>
	<author>  
		<name>Sam</name>
			<lastName>Freek</lastName>
	</author>
	<ISBN>0-201-12188-6</ISBN>
	<edition>Second</edition>
	<publisher>VVM</publisher>
  </book>
  <book inStock="Yes" price="39.22">
	<title>The Moon Story</title>
	<author><name>M.</name>	
		<lastName>Rainsburg</lastName>
	</author>
	<ISBN>0-251-16135-2</ISBN>
	<edition>Second</edition>
	<publisher>RS Media</publisher>
  </book>
  <book inStock="No" price="44.98">
	<title>Some Title</title> 
	<author>mixedContent<name>A</name><lastName>Name</lastName></author>
	<ISBN>0-251-16135-2</ISBN>
	<edition>Second</edition>
	<publisher>RS Media</publisher>
  </book>
  </bookList>
